和杨侍御筠湄秋怀（清·朱载震）　　七言律诗　押灰韵	薄醉江楼怀暂开，家园迢递首重回。淡香红叶霜前径，细蕊黄花雨后苔。汉祖频年思猛士，燕昭何日筑金台。不才自合烟霞老，未许天边鸥鹭猜。
同石城公牛潜子秋日汉上（清·朱载震）　　七言律诗　押麻韵	澄陂秋柳带明霞，茅屋参差野老家。江转危矶奔骇浪，村邻小市缀疏花。河鱼入馔偏堪饱，浊酒能酣不用赊。赢得山公清兴在，停骖闲数后栖鸦。
雪中呈黄湄先生（清·朱载震）　　七言律诗　押微韵	钟动明光接曙晖，雪花片片点朝衣。玉珂积素趋仙杖，金勒凝寒出琐闱。北极楼台天上迥，西山云树望中微。闭门有客还僵卧，岁暮羁愁未得归。
夏过北兰寺（清·朱载震）　　七言绝句　押尤韵	寺通野阜转清幽，压户藤梢带叶抽。最好江洲浮远绿，孤悬塔影漾中流。
牧仲见贻方竹杖赋谢（清·朱载震）　　押蒸韵	明日别公庐山去，赠我竹杖随行縢。体方节坚色滑净，一条碧玉锋棱棱。侧闻分宁邃岩谷，狼虎部曲蒙茸藤。截致颇难形甚古，大朴不雕囊以缯。世闻圆柔易为好，直方谁解堪依凭。我老懒拙无一可，舍藏信宜行未能。大布一领书一簏，漫游得此真良朋。匡君旧识不我弃，招手高峰穿崚嶒。扶携万仞观天地，大笑齐物无鹍鹏。拜公嘉锡感公意，知己名言永服膺。何当杖头书岁月，幽寻衡岱嵩华恒。
建兰（清·朱载震）　　押药韵	丛兰生幽谷，莓莓遍林薄。不纫亦何伤，已胜当门托。辇至逾关山，滋培珍几阁。掉头忘闽海，倾心向京洛。轻飔昼回芳，清泉晚宜瀹。玉轸一再弹，天际如可作。
