将有远游示舍弟美叔（清·李佳）　　五言律诗　押真韵	行行远离别，手足诉悲辛。万里吾为客，三年汝养亲。仓皇忧世乱，少小际家贫。淮海春波绿，相期寄尺鳞。
客思（清·李佳）　　五言律诗　押真韵	少小依亲侧，饥驱走此身。堪怜倚闾意，常念远游人。树色随淮尽，梅花过海春。南辕何日返，挥涕望风尘。
郭外（清·李佳）　　七言律诗　押萧韵	佣书已罢浑无事，出郭寻春不厌遥。桑桑满畴蚕妇喜，麦田三月雉媒骄。香雏美酒村前市，画鹢垂杨水外桥。岁晚傥营三亩宅，故人栖隐许相招。
金陵词忆葆之（清·李佳）　　七言绝句　押支韵	城北城南杨柳枝，金陵三月雨如丝。天涯有客应惆怅，正是江南草长时。
南山访友人（清·李佳）　　押曷韵	朝雨过清溪，风生水云活。馀霞散城表，残虹霁天末。青山如拱人，万黛浓欲泼。小桥通幽径，林尽见疏豁。坐石埽菭花，登峰拊藤葛。隔树透晨烟，依依一痕抹。遥仪素心人，越夕成契阔。抱琴叩柴关，相见慰饥渴。
出门行（清·李佳）　　押阳韵	十五出门行，父母泣中堂。二十出门行，妻子悲空房。三十出门行，儿女牵衣裳。出门既已苦，况复道路长。道路三万里，不复见家乡。黄金络马头，青丝为马缰。行行从此去，已去休旁皇。上堂别父母，父母愁未央。入房别妻子，妻子悲断肠。出门别儿女，儿女询归装。此去三万里，远道殊茫茫。黄河无舟楫，深山多虎狼。绝域不通书，谁复知死亡。家居何不乐，耽此道路长。
短歌行赠王义门（清·李佳）	相君不合长数奇，胡为劳劳久行役。一第驰驱国士心，十年沧海风尘色。世乱纷纷如弈棋，归来少妇展双眉。出门谁道长安乐，老大王生空尔为。
