湖山谒桓简公祠（清·洪饴孙）　　七言律诗　押东韵	内史勋名恨未终，荒祠间访赏溪东。封疆独际艰难日，俎豆犹思捍御功。再世公卿惭长吏，百年忠义惜家风。枋头兰石兵俱败，书法阳秋自不同。
早发马底驿至辰阳（清·洪饴孙）	溪危周千盘，石险露百状。百转山径间，溪流愈平放。峰尖棱棱石纹起，一抹山痕全作紫。邮亭十里晓雾多，村屋高低乱云里。秋林苍茫曙光湿，绝顶一峰衔日出。沿溪藻影漾晓华，惊起游鱼争欲匿。水流百折波自通，泉石荡漾浮云空。此间作县亦清绝，山色绕北溪流东。参关高原踏晨露，马恋山光亦回顾。野人短褐上山樵，却立云峰最高处。
清镇道中（清·洪饴孙）	空林昨夜春雨霏，惊起百道山泉飞。幽禽时啄碧藓肥，石屋春冷行人希。笋舆上下折不休，山翠频转频回头。一山转出花满洲，花色大放风前眸。嫣红姹紫纷相映，倒影溪光静如镜。竹坞云林转不穷，冷香薄雾吹无定。花前山色轩晴午，山里山亭俯寒渚。洒空新绿鸟啼声，有客间来课鹦鹉。
云海谣赠郑生德徽（清·洪饴孙）	名山变幻不可知，飞云作海何恢奇。淋漓元气来无时，倏忽波浪纷交驰。霞光融融动晨曦，万顷旋见堆琉璃。此时群仙笑且嬉，手弄云水相追随。莲华峰头望陆离，如坐翠艇游天池。仙僧行脚经年载，为我明明说真宰。五更天风变崔嵬，独坐云门看挥洒。前峰后峰荡晴采，似云非云海非海。烟鬟螺髻须臾改，一气冥濛卷块垒。莲蕊松林尽蓓蕾，共入烟云化苍澥，下视奔腾动堪骇。天都翠微参碧穹，灵气上与层霄通。阴晴朝夕各不同，如启橐籥开元宫。初见谷口云滃滃，忽觉天半波汹汹。三十六朵青芙蓉，动影出入苍涛中。翠嶂都觉浮虚空，天日无际博桑红。浮丘生与容成公，跨鲤游戏乘仙风。下界时响泠泠钟，到眼浩荡开心胸。岂有旋转推鸿濛，造化幻影知无穷。风声水声去何疾，云兮海兮转无迹。皎皎羲轮照奇石，依旧诸峰挺寒碧。我为云海谣，欲作云海樵。黄山山头暮复朝，日餐流瀣居云巢。云为醴兮星为瓢，吐纳清气如灵潮。芝膏朮饵手自调，俯弃尘世同鸿毛。列真一旦抗手招，为驾采鹿驱仙轺。东溯溟渤西神皋，瞬息千里何飘摇。空中雅奏鸣天韶，可以狎视烟海穷云霄。喜君却住黄山坳，逸气欲与山争高。通眉秀骨森清标，爱客为我披蓬茅。君诗君笔亦复超，我歌我谣庶勿嘲。君不见山南阴阴杂檀柘，我有先人白云舍。鹤背从君傥同跨，遥指横云古峰下。
自洪坑至岑山渡道中（清·洪饴孙）	一碧渐江水，众壑含虚明。岑山峙中流，力与惊涛争。孤峰荡回飙，万绿吹冥冥。唤渡人偶来，鉴影毫发清。风声与水声，澒洞益可听。三两莲叶舟，渔网挂晚晴。我家距岑山，五里云坡平。时餐渐江水，仰止岑山行。古岸倚绝壁，踏歌行客情。清梦有时去，醉月吹瑶笙。何时理钓蓑，来与江鸥盟。
朱兰坡宫允雪夜绷儿图（清·洪饴孙）	茅檐三尺喧悲风，床头蚁斗声汹汹。此时儿啼不应待，孤绷夜走深山中。启明闪影天将白，药鼎茶铛果谁责。此时儿醒不容啼，牵绷晨返寒溪侧。儿生百日父即危，对儿惟有双泪垂。朝来暮去冒风雪，茕茕两地恒相随。风饕雪虐儿啼急，宿鸟翻飞和悲泣。劬劳当日谁则同，此意应参蓼莪什。忆昔屡游黄{山兖}峰，贞珉彤管传慈容。德门一过一矜式，谓有畸人贤母之高踪。小人有母未传德，四十无成老将及。披图未竟已吞声，笔不能持但嗟息。我前老屋居江湄，危楼一间半欲欹。楼前杌隍安一梯，楼下积雨常如池。断椽坏木纵横支，临深履薄难扶持。当时吾母随重慈，井灶葱薤旁无司。左携杯棬右抱儿，虞儿转侧啮以衣。偶然失足不可思，危梯上下行岖崎。齿痕儿泪时相续，血印斑斑见襟幅。至今风木不停鸣，我念慈恩抱梯哭。羡君史笔能酬养，母教无须采风上。只教惊心捧檄人，春晖寸草空神往。剩有悲怀祇自知，北堂茹苦报何迟。徒闻膝下通侯贵，亲见深宫绘画时。
入峡书所见（清·洪饴孙）	江流欲无险，峡势尚未平。峨峨夷陵山，遑肯西南倾。怒石指上流，力与惊涛争。一折不能御，奋迅催雷霆。遂令下吴楚，所向皆空明。我思古直躬，抱负每不恒。艰贞乃隐者，骨鲠惟孤臣。无论事成否，此心皆至诚。乾坤萃清气，孕秀归精英。鬻拳与正则，安知非降灵。我欲登兹山，旷览风云生。王事动靡盬，怀古空斯行。沿回挂帆过，峡口云冥冥。
