人日遣闷（清·王以敏）　　七言律诗　押阳韵	掠面清风酒在亡，春云晓梦两茫茫。天涯岂料逢人日，海外谁传获鬼章。地僻鱼蔬登肆晚，岁新笳鼓赛神忙。空林独立翻成笑，北雁何曾识故乡。
冬夜读吴门沈润生二白词（清·王以敏）　　七言绝句　押庚韵	空山谁按九歌声，一种斜阳万古情。绿发搔残红袖冷，江南肠断沈初明。
怀易五实甫赋寄都门（清·王以敏）　　押尤韵	惊飙荡颓云，行人何时休。别君未经旬，嘉会成千秋。当时两年少，意气轻王侯。小蹶不知惜，宁畏风尘游。及兹三载逢，射策终未收。君羁长安踪，我返琅邪辀。临歧一握手，泪忽缘缨流。勋业不一建，岁月去我遒。岂伊恋别离，奈此霜盈头。白日何昭昭，河水何悠悠。飞鸟各适林，嗟我谁为俦。高名鬼先恶，清狂世所尤。珍重千金躯，慎勿耽冥搜。已矣不复道，各勉独善谋。
登岱绝顶放歌（清·王以敏）　　押东韵	乱山北走如游龙，岱宗屹立东溟东。胚胎元气孕万有，独踞震位鞭群雄。我来二月雨新霁，喜见突兀凌苍穹。云声涛影接咫尺，呼吸似与神灵通。天梯万仞不可以径度，朱阑一线悬长虹。峨峨南天门，双阙缥缈中。秦观日观左右峙，俯视下界青冥濛。摄衣直走太清宫，两袖浩浩来天风。齐烟飞青吴练白，混茫八极畴能穷。海水一变河一勺，何论凫绎兼龟蒙。惜哉西山去我远，举首不见扶桑红。手折秦松下山去，半岭星月摇青空。我闻蓬元仙药寿无极，青天跨鹤何匆匆。笑谢山灵约息壤，誓晞绿发寻崆峒。
游佛峪龙洞偕石励斋张采南孝廉（清·王以敏）　　押屋韵	天风吹石梁，金碧炫岩腹。万花两空际，宝相一何肃。山僧出迎客，野饷杂溪蔌。散发对屏帐，开襟到童仆。一蝉户外鸣，导我访灵瀑。香乳漱云石，阴籁荡琴筑。佳哉草木气，照水同一馥。閒持酒巾浣，静观游倏逐。何处烟寺钟，凉蟾挂疏木。
游皋兰山（清·王以敏）	东岩悬流若铿玉，西岩喷瀑如鸣筑。两岩路断青扉开，古柏阴森扑眉绿。摄衣拾级趋琳宫，飞阁连云满岩腹。能仁高卧何处寻，空山落叶无古今。香烟欲烬栖鸟散，长河如带悬疏林。惊飙荡空白日晚，坐觉尘嚣去人远。兴来瀹茗掬清泉，更逐归云度层巘。清晖阁里金尊开，秋色极天边马哀。接倒著径归去，忆尔征西骠骑才。
六盘山（清·王以敏）	积雪瞻太华，油云揽东岱。今过六盘山，益信天狡狯。高高陇坂云，横分雍梁界。一支走北地，群山互鳌戴。梯空安可穷，毋乃厚坤隘。七月阴崖寒，风雨白日晦。千盘作螺旋，百转出鸟背。登高望西极，川原尽破碎。一身裹云气，焉能辨泾汭。元昊昔盗兵，藏鸽逞机械。宋师实不竞，赤手搏蜂虿。惜哉一韩名，何救好水败。元老圣朝出，军威震无外。一清关陇尘，再荡祁连秽。兹山屡驻节，烟岚壮旌旆。事往哲人萎，攀柳尚遗爱。凄其陇头水，邈矣风云会。驱马拜萧寺，松风漱寒籁。元宫亦成尘，惟有名山在。
惜余春慢 题小檀栾室汇刻闺秀词（清·王以敏）	芬佩搴兰，铢衣散锦，到眼墨云交绚。飘灯珠箔，伫月晶帘，销得燕愁莺惋。不信人天感多，捣麝犹香，拗莲难断。恁风流也称，玉台新序，衍波传遍。京国事，井华朝汲，秋水宵吟，法曲红箫亲按。去年元夜，佳节重阳，南宋倩魂还见①。艳绝珊株网闿，百衲补琴，九华裁扇。听瑶空、笙鹤风高，花外绮霞吹满。
