读板桥杂志吟八怪（近现代·薛双甲）　　七言律诗	维扬自古多文士，八怪书生更俊豪。妙笔画兰神彩彩，墨波涂竹影箫箫。楷书篆隶创新意，词曲诗文求古高。愤世远尘扬道义，为人重品仰高标。
游常熟方塔（近现代·薛双甲）　　七言律诗　押阳韵	宝塔层层接上方，谁将舍利此中藏。孤高拔地淩霄汉，金碧摩天向艳阳。足蹑云梯入缥缈，耳闻风铎奏宫商。慧光纵使高千尺，不及文光万丈长。
上灵岩山寺庙礼佛喜赋（近现代·薛双甲）　　七言绝句	久困书房思活动，灵岩礼佛步从容。命中教我无财气，乐趣诗书加酒盅。
自题名片（近现代·薛双甲）　　七言绝句　押阳韵	无衔名片不吃香，何必麻烦印刷商。弄墨消閒自己写，或逢知客乐收藏。
无题（近现代·薛双甲）　　七言绝句	落拓一生携酒瓶，形容易瘦骨难轻。閒来种得青青竹，劲节虚怀四季春。
奉和华继善先生七绝诗一首（近现代·薛双甲）　　七言绝句　押真韵	春色阑珊不算春，清狂日与酒为亲。粗茶淡饭寻常过，信谊交情乃足珍。
游南湖（近现代·薛双甲）　　七言绝句　押阳韵	初冬十月菊花黄，烟雨名楼聚一堂。莫道西湖山水好，南湖画舫闪金光。
题梦馀集二首（近现代·薛双甲）　　七言绝句	下肚三杯满腹春，诗催半夜梦常醒。一从迁入南楼住，情涌毫端花满林。
