东湖（清末民国初·陈锐）　　五言律诗　押尤韵	堤畔初黄柳，垂垂识客愁。轩亭销丽日，风露共清秋。世外閒双桨，天涯讯一鸥。君看十刹海，何似百花洲。
自长沙至桂阳途中杂诗（清末民国初·陈锐）　　五言律诗　押青韵	昨宿空泠岸，滩声枕上听。今看樟木寺，岳色眼前青。云物犹潇洒，天人一杳冥。何因羡翀举，叩齿诵黄庭。
望江南（清末民国初·陈锐）	春不见，孤负可怜春。淡柳锁愁烟漠漠，小阑扶恨水粼粼。往事已成尘。人不见，孤负可怜人。花下又逢三月雨，梦中犹隔一条云。风露夜纷纷。
鹧鸪天（清末民国初·陈锐）	尺碧晴丝系玉骢。画楼西畔记相逢。眉愁暗阁啼时雨，脸晕微生酒后虹。临水怯，对花慵。奈何郎也奈何侬。郎行只在斜阳外，閒却阑干一角红。
暗香（清末民国初·陈锐）	怨尘凝碧。自黯然不扫，眉边春色。有美一人，晓起临妆耿相忆。偏是团圞镜里，早换却、从前标格。算别后、点臂宫砂，红润见欢迹。消息。又寂寂。空卜断玉钗，写遍飞帛。枕函梦滑，衣带无情有宽窄。谁解人生恨事，总付与、孤灯寒滴。便再世相聚也，那能记得。
一萼红 寒灯（清末民国初·陈锐）　　押灰韵	锦屏隈。有孤檠浅照，风急雪还催。摇影膏轻，垂头穗重，寒透今夜兰台。乍相值、亭亭不语，盼雁足、悽立几曾回。绘彩流光，鱼龙生戏，何处蓬莱。闻道九华歌散，怕相思一豆，剔尽成灰。微火多情，余花自笑，空叹春谜难猜。暗枨触、儿时况味，教谁见、墙角替人哀。弟一丁宁，闹蛾莫又飞来。
浣溪纱（清末民国初·陈锐）	花外敲门唤酒迟。春愁先到绿杨枝。客怀更不自矜持。往日风流疑作梦，而今漂泊懒填词。黄昏微雨上灯时。
烛影摇红 寒衾（清末民国初·陈锐）	鸳馆单栖，被池一榻怜春浅。凄凉听雨总无眠，咽水更虬转。两字相思画惯。意绵绵、挨宵望旦。去时风月，似铁多年，冰蚕曾见。四角平铺，贴胸拥背今嫌短。重重锦烂是天涯，梦隔床头远。怀里余香未散。剩啁啾、罗浮浸眼。向空斜抱，细数归期，绮罗庭院。
绕佛阁（清末民国初·陈锐）	酒波一剪。蛾绿借晕，涡笑深浅。鲛帕痕满。背灯斜揾，娇凝怕人见。醉眠爱晚。还说别后，偏怎宵短。佳约幽缱。画屏素月，香销水沈篆。晓阁漏壶滴，铁马珠筝敲碎片。何限艳尘，飘零心与眼。问隔枕秋声，孤凭谁惯。断魂今断。怕翠羽林啾，芳梦吹散。拂愁丝、镜霜新染。
琐窗寒 寒柝（清末民国初·陈锐）	刮地初霜，临关半月，乱鸦飞尽。逢逢响彻，危烛戍楼烟烬。碎乡心、三更四更，一更一点归期近。想提灯窄巷，老兵传语，月光如凝。宵迥悲同省。但急节和砧，严声催枕。晨钟未动，谁报晓天鸿信。自无人、深院漏沈，小尨觑竹遥吠影。总输他、断木中空，赚得残年恨。
水龙吟 寒钟（清末民国初·陈锐）	大千春色飘残，世尊寂听浑如睡。摇摇断杵，碧云欲莫，寒山转媚。烟际悬音，霜前送梵，荡空无地。忽奔涛万壑，一时都到，阎浮界，松风起。落月乌啼鸱尾。隔重城、梦遥南寄。晓天百八，高楼何限，景阳清泪。上界灯幡，故宫龙象，铿訇愁思。又西头打鼓，朝朝莫莫，入离人耳。
探春慢 寒角（清末民国初·陈锐）	荒雾悬旌，冷风卧鼓，蚩尤宵堕平野。一叠严霜，连天晓奏，吹散胡群牧马。多少清商怨，借兜勒、乌乌共写。轮台昨夜军声，老兵惊起愁话。长是悠扬壮峭。催卷甲疾驱，弓折难把。幕府琵琶，龟兹觱栗，不共别情閒冶。余响归铙外，听斛律、牛羊来下。自恁单衣，南山留扣修夜。
垂杨 寒罾（清末民国初·陈锐）	渔村夜觉。郑柳堤细涨，鲤鱼风小。楚竹安排，乱流低罩潜蛟悄。鸣榔生长潇湘道。识无际、浪花深窈。甚茸蓑、冷坐滩头，叹近来鱼少。圆网平铺了了。觑霜蟹出沙，罥丝青袅。拽起还抛，一灯沈照鸥天晓。浮萍四角吹如扫。荡沫雨、中央缥缈。祇年时插脚泥涂，吾亦老。
玲珑四犯 寒砚（清末民国初·陈锐）	鸲眼凹深，记淡墨题诗，花气熏昼。几日霜毫，吟案冷铺毡绣。呵手坐费摩挲，祝片石、暖云生酒。甚泪蟾、铸就相思，空盼泮冰时候。十年磨铁波纹皱。照方池、寸心灰勾。冬烘苦被儿童笑，短箧随人后。谁拭半面冻尘，曾貌写漳台春瘦。且莫教焚却，乘醉也，一濡首。
浪淘沙慢 沪上送易由甫，用清真韵（清末民国初·陈锐）	送君路、潮奔极浦，雾压荒堞。归兴无端自发。清歌即席乍阕。看鬓角眉尖愁共结。柳条碧、素手亲折。料此后风萍逐流水，人天事悽绝。清切。古今望眼空阔。对浩荡神州沈陆恨，付与霜雁咽。休更说江湖，朋旧轻别。艳才易竭。销几回、来去春花秋月。平地羌笳悲风叠。楼台好、胜游渐歇。拂明镜、婵娟圆又缺。问梦觉、十万莺花，甚玉色、伤心一夜青丝雪。
庆宫春 寄怀文叔问舍人苏州，用草窗韵（清末民国初·陈锐）	修鹤梅崦，零鸥荷荡，画船几听吴雪。催老清歌，惊春狂泪，市箫何限悽咽。梦游如絮，莽万里、烟尘顿合。京华北望，鼓角南来，壮肝都裂。昔时倚醉承平，怒马鲜裘，侠情双绝。朱颜照水，而今鹪{左卒右鸟}，怕见海潮生月。旧题团扇，肯怜我、欢场携别。山中芳杜，远道相思，不堪亲折。
东风第一枝 武昌客舍送宋芸子赴长安（清末民国初·陈锐）	袖海龙吟，巢阿凤羽，文章当日雄绝。壮游几换桑田，愤怀暗悲错铁。人间何世，恰值我、江关时节。算分手、蓟北湘南，早办十年离别。行倦也、玉骢愁咽，春半也、杜鹃啼血。眼前去路谁赊，客中醉颜易热。飞绵万点，莫吹逐、天涯头白。祇送君、一片相思，梦绕旧京明月①。
绛都春 春泛黄浦（清末民国初·陈锐）	吴天远秀，荡绿波一镜，杳朗无尘。望里画楼，此时愁绝送春人。秾桃淡柳纷相引，燕归容易黄昏。好花空发，垂丝自结，负了芳辰。几岁江关赋本，但奔驴共命，唳鹤招魂。故馆夕阳，沧桑留影照金尊。临流急泪休轻揾，眼前谁辨清浑。便催乌榜，东风醉拾钓纶。
莺啼序（清末民国初·陈锐）	春江送愁更阔，甚抽刀断水。浪花似、片片柔情，急流还蹴连蕊。酒衫重、尘痕未浣，筝船晓月陈欢坠。想桃根、双楫临风，几触离思。乌鹊南飞，画鼓夜紞，感从军荡子。枕函梦、曾说飘零，玉骢消息难至。悔殷勤、封侯误觅，换年鬓、沧桑弹指。剩狂歌，谯隐楼头，问天何意。邯郸过客（未聃小印），襆被僧房，听疏钟不寐。还暗省、维舟邗上，抑掩幽哽，隔座琵琶，烛龙催泪。分明在眼，家残国破，窜身来向江干哭。看新蒲、野老都憔悴。何堪捉臂，当场促管传杯，恼人鹧鸪天里。知音自惜，邂逅填词，总惹红怨翠。君不见、孙刘栖憩。若个英雄，很石苔荒，乱鸦惊起。潇湘波淼，归欤何日，风流摇落悲宋玉，写兰荃、休更微声倚。苍茫第一江山，第一相思，缩来寸纸。
十二郎 烟雨楼在滮湖中，其左背郭，西连鸳鸯湖，为禾中第一胜境。用梦窗垂虹亭韵题意（清末民国初·陈锐）	絮云蘸水，放郭外、嫩情如凝。唤翠笛吹烟，银匏携酒，同上南湖钓艇。轧哑菱歌清香里，暗橹歇、鸥眠才定。看过雨荇荷，通波亭榭，渐忘尘境。佳兴。吴侬浣罢，淡妆窥镜。自鹿去苏台，蠡施偷嫁，谁向鸳鸯顾影。恨眼伤高，绮才消别，愁接越来潮冷。呵素壁、醉墨分题，付与塔铃摇暝。
