癸酉除夕（元·刘汶）　　五言律诗　押真韵	此夕何多感，明朝过六旬。乾坤又元统，人物少咸淳。酒厌山杯渌，梅伤水国春。灯前曾戏綵，马首一沾巾。
早春述怀（元·刘汶）　　五言律诗　押蒸韵	春与年年别，穷随日日增。眼明贪夜读，事少忘晨兴。倦鸟犹迁木，潜鱼已陟冰。栖迟唯故辙，无梦到飞腾。
寄赠华阳洞隐者（元·刘汶）　　七言律诗　押先韵	一日书成四海传，华阳始信有儒仙。神交弘景吹笙夜，心在留侯辟谷年。重碧拈春瓢贮月，硬黄临帖研分泉。山中物色清无限，便拟凌云到洞天。
次韵张伯雨蕉池积雪诗二首（元·刘汶）　　七言律诗　押青韵	铜驼陌上得铜洗，曾见汉朝风露零。寒光未变劫灰黑，古色犹带宫苔青。金人堕泪漫怀古，玉女洗头真寓形。与君作池媚蕉雪，何以报之双玉瓶。
言志叙交四十韵答欧阳元翁（元·刘汶）　　五言排律　押支韵	滚滚沧江去，茫茫暗谷移。黑头那敢恃，华发会相欺。遂起纷如叹，能忘逝者悲。著书谁发愤？追古独忘疲。讲授尝佔毕，研穷几下帷。群经元奥妙，百氏苦支离。索隐妨修业，谈经失秉彝。反身惟一理，遵道岂多歧。新意方来际，陈言尽去时。夏虫冰莫讶，越犬雪休疑。浮世春荣过，幽园夕秀迟。后凋终有待，直养可容亏。向使常流混，宁逃具眼嗤。投閒欣事省，扫迹畏人知。环堵差堪恋，长沙去若为。趋庭因泮藻，赠客且江蓠。回顾皋比冷，还思宝玦遗。羁愁生雨外，乡梦落天涯。每慨渊明菊，将寻绮季芝。未谐莱氏隐，频念鹿门期。友谊今踰薄，儒流子尚奇。刚肠俱比石，末俗竟如脂。缀曲唯同病，论诗固解颐。率更仍翰墨，六一再文辞。解接家声远，兼扶士气衰。埙篪参雅奏，椿桂亚高枝。正始音能续，元和脚肯随。浑雄亲汉魏，绮靡却陈隋。浪许鲲鱼舞，云看骏马驰。驽骀羞抗臆，鳅鳝愧扬鬐。不尽沙金拣，犹□璞玉治。受辛惊绝倡，胜己辱先施。欧冶加锋锷，刘墙力塈茨。吾侪非敢傲，儿辈自宜麾。学要千年蕴，名须万古垂。匪徒攀屈宋，深望溯濂伊。天运流无息，人生志勿卑。操怜松郁郁，节抚竹猗猗。尽拟泠风脚，何曾俗骨医。煎胶得麟凤，岁晚愿深资。
赠刘禹玉（元·刘汶）	刘郎方朔徒，游戏紫泥海。千年华表非，唯有寸心在。向来浙河西，雄辩吞虹霓。手携九节杖，东入蓬莱栖。我时探禹穴，同看山阴雪。千人万人中，怪子独超越。朝骑白鼻騧，暮逐油壁车。得钱即付酒，携妓颜如花。踏翻豪侠窟，醉狎山人家。或嘲狂处士，或诮报恩子。从渠立名多，讵识子奇伟。一朝去乡国，北上争吹嘘。家无十金产，袖有万言书。所陈果何事，为国非自计。宁遭丞相嗔，肯负丈夫志。蹉跎十数秋，甘与黄冠俦。善藏倚天剑，未暇磨斗牛。幡然走山东，隐迹随壶公。还寻岱宗去，绝壑凌天风。鸡鸣上日观，眼乱扶桑红。窥临事未已，逸气横万里。行歌齐鲁间，兴为庐山起。庐山秀可餐，怡此冰雪颜。挥毫洒瀑布，五老开云关。远公拍手笑，喜见遗民还。乃知士不偶，正可游名山。去年卧衡岳，聊憩四海脚。厌垂君平帘，懒卖伯休药。却呼魏夫人，共把流霞酌。今年与山辞，下走湘水湄。临风吊贾傅，酹月招湘累。文章本疏荡，强忍终技痒。光怪不可收，倏忽又千丈。有时遇知音，朗咏山中吟。复恐儿辈觉，不得容山林。兹辰忽聚首，慰我别来久。辛勤四十霜，所获竟何有。却怀居东时，勇以功名期。焉知尚漂泊，筋力供路歧。举杯置往念，此去安所之。南窥古云阳，更了山川奇。山川固娱目，慎勿过幽独。奈何白云歌，再送刘十六。乾坤渺苍茫，回首眷空谷。我将秣其驹，乃不受羁束。愿子无遐心，归哉返初服。
