罗敷行（南北朝·顾野王）　　押支韵	东隅丽春日，南陌采桑时。楼中结梳罢，提筐候早期。风轻莺韵缓，露重落花迟。五马光长陌，千骑络青丝。使君徒遣信，贱妾畏蚕饥①。
陇头水（南北朝·顾野王）　　押先韵	陇底望秦川，迢递隔风烟。肃条落野树，幽咽响流泉。瀚海波难息，交河冰未坚。宁知盖山水，逐节赴危弦①。
阳春歌（南北朝·顾野王）　　押微韵	春草正芳菲，重楼启曙扉。银鞍侠客至，柘弹宛童归。池前竹叶满，井上桃花飞。蓟门寒未歇，为断流黄机①。
艳歌行三首（南北朝·顾野王）　　押微韵	夕台行雨度，朝梁照日辉。东城采桑返，南市数钱归。长歌挑碧玉，罢尘笑洛妃。欲知欢未尽，栖乌已夜飞①。
饯友之绥安诗（南北朝·顾野王）	谷风扬暖律，扶旭开馀霭。兰芽被平皋，冰澌泮微濑。悟彼芳岁新，惬此赏心会。丝竹邯郸倡，朋游邺中盖。贡橘伟含滋，仙鲻妙飞鲙。崚嶒眺广岳，浩溔穷溟海。众宾悦礼遇，远俗怀仙爱。操输本非工，无讥比曹郐①。
芳树（南北朝·顾野王）　　押阳韵	上林通建章，杂树遍林芳。日影桃蹊色，风吹梅径香。幽山桂叶落，驰道柳条长。折荣疑路远，用表莫相忘①。
有所思（南北朝·顾野王）　　押遇韵	贱妾有所思，良人久征戍。笳鸣塞城表，花开落芳树。白登澄月色，黄龙起烟雾。还闻雉子斑，非复长征赋①。
长安道（南北朝·顾野王）　　押麻韵	凤楼临广路，仙掌入烟霞。章台京兆马，逸陌富平车。东门疏广饯，北阙董贤家。渭桥纵观罢，安能访狭斜①。
