赠毛仙翁（唐·杨于陵）　　五言律诗　押删韵	先生赤松侣，混俗游人间。昆阆无穷路，何时下故山。千年犹孺质，秘术救尘寰。莫便冲天去，云雷不可攀。
和权载之离合诗（唐·杨于陵）	校德尽圭璋，才臣时所扬。放情寄文律，方茂经邦术。王猷符（一作三献偕）发挥，十载契心期。昼游有嘉话，书法无隐辞。信兹酬和美，言与芝兰比。昨来恣（一作念）吟绎，日觉祛蒙鄙。
郡斋有紫薇双本自朱明接于徂暑其花芳馥数旬犹茂庭宇之内迥无其伦予嘉其美而能久因诗纪述（唐·杨于陵）　　押虞韵	晏朝受明命，继夏走天衢。逮兹三伏候，息驾万里途。省躬既局蹐，结思多烦纡。簿领幸无事，宴休谁与娱。内斋有嘉树，双植分庭隅。绿叶下成幄，紫花纷若铺。摛霞晚舒艳，凝露朝垂珠。炎沴昼方铄，幽姿闲且都。夭桃固难匹，芍药宁为徒。懿此时节久，讵同光景驱。陶甄试一致，品汇乃散殊。濯质非受彩，无心那夺朱。粤予负羁絷，留赏益踟蹰。通夕靡云倦，西南山月孤。
登石伞峰（唐·杨于陵）　　押冬韵	夙志慕遐峤，偶时叨抚封。幸兹秋成候，得与心期从。宛在洲渚外，稍跻林岭重。紫垣感嘉惠，丹壑畅幽踪。之子绰有裕，结庐枕前峰。亭台互亏蔽，物象分轻浓。玉伞践危石，苔枝栖古松。登攀逐群彦，息偃惭衰容。阊阖如可接，灵仙疑暂逢。海帆去的的，霜雁来噰噰。赫奕护军重，导迎裨将恭。回舟迟新月，鼙鼓迎疏钟。
习家池大堤诗（题拟）（唐·杨于陵）　　押齐韵	习氏踪谁寄，羊氏道可跻。
句（唐·杨于陵）　　押齐韵	云敛荆门近，江平岘首低。
