山中（明·田艺蘅）　　五言律诗　押支韵	避俗非遗世，无材合背时。独居如我僻，幽事与心宜。暮雨喧茶臼，秋山落研池。临风闻伐木，犹自动遐思。
游三茅山访郑炼师（明·田艺蘅）　　五言律诗　押尤韵	小隐居城市，悠然寄一丘。青山同入定，黄叶自悲秋。湖影摇晴榻，钟声度暝楼。丹砂何日就，期尔在玄洲。
雨中感怀寄诸故人（明·田艺蘅）　　七言律诗　押东韵	三十年来尚转蓬，学书学剑两无功。数椽茅屋寒江上，一树梅花细雨中。闻雁忽惊时序晚，对山不觉酒船空。高阳旧侣能相念，冰底双鱼尺素通。
西湖题小桃王氏别馆（明·田艺蘅）　　七言律诗　押麻韵	柳外朱楼绚彩霞，阿谁湖上浣春纱。留人燕子初命子，映面桃花恰始花。轻薄未应来邺下，呢喃多是怨王家。东风频驻青骢马，无那桥西酒旆斜。
月夜即席示座客（明·田艺蘅）　　七言绝句　押萧韵	云散江城玉漏遥，月华浮动可怜宵。停歌不饮君何待，试问当年李玉箫。
夜投禅院（明·田艺蘅）　　押删韵	暝暝溪路转，初月隐林间。孤灯在深竹，清流影前山。倚树露欲滴，扣门僧正闲。宿好雅相得，明发何能还。
塞下曲（明·田艺蘅）	黑风卷沙平太行，辕门列戟飞秋霜。敲冰饮马万蹄裂，旄头白日寒无光。胡笳叫屈角声死，短兵战过交河水。不恤身为塞下磷，孤光还照长城里。
戎政府（明·田艺蘅）	大将新开戎政府，门外列校如狼虎。团营十二坐指挥，此生焉能与哙伍。咸宁旗偃虏骑来，咸宁旗出虏骑回。九庙震惊本兵死，帐中歌舞方行杯。宠锡如山印如斗，君恩愈深臣愈负。兔窟深藏屠酤儿，驼帏屡纳单于妇。平头奴子腰尽黄，不独秦宫花底狂。内家珠玉耀权室，锦衣目侧旋中伤。猿鸡飞去痈疽溃，曾公夏公来作祟。西湖一庄不忍捐，带砺山河片言坠。劈棺僇尸枭九边，娇妻稚子藁街悬。誓书未及传三叶，血食宁知绝九渊。郿坞空为万年计，落花满地朱门闭。鸡鸣狗吠散如烟，宠姬给配功臣第。就里尤夸俞七儿，新人重事尚娇痴。闹装宝束今何许，玉带曾劳柘柳枝。
钱塘门（明·田艺蘅）	雒阳曾闻北邙道，浙江今见钱塘门。朝朝五鼓灵狖发，苦雨悲风愁断魂。西湖山中白杨树，今人古人几丘土。撅人白骨筑新坟，何遽今人不成古。世人有死亦有生，依然冠盖满杭城。妖童艳妾不可保，何况槐第连蒿茔。湖上笙歌引纨谷，一半欢娱一半哭。狐狸衔出夜台衣，乌鸦乱攫春盘肉。丈夫处世求乐多，有身耐埋金叵罗。雷霆不使人醉耳，忍听城门《薤露》歌。
