诉衷情（唐·魏承班）	高歌宴罢月初盈，诗情引恨情。烟露冷，水流轻，思想梦难成。罗帐袅香平，恨频生。思君无计睡还醒，隔层城。
生查子（唐·魏承班）	烟雨晚晴天，零落花无语。难话此时心，梁燕双来去。琴韵对薰风，有恨和情抚。肠断断弦频，泪滴黄金缕。
菩萨蛮（唐·魏承班）	罗裾薄薄秋波染，眉间画得山两点。相见绮筵时，深情暗共知。翠翘云鬓动，敛态弹金凤。宴罢入兰房，邀人解佩珰。
渔歌子（唐·魏承班）	柳如眉，云似发，鲛绡雾縠笼香雪。梦魂惊，钟漏歇，窗外晓莺残月。几多情，无处说，落花飞絮清明节。少年郎，容易别，一去音书断绝。
满宫花（唐·魏承班）	雪霏霏，风凛凛。玉郎何处狂饮，醉时想得纵风流，罗帐香帏鸳寝。春朝秋夜思君甚，愁见绣屏孤枕。少年何事负初心，泪滴缕金双衽。
谒金门（唐·魏承班）	烟水阔，人值清明时节。雨细花零莺语切，愁肠千万结。雁去音徽断绝，有恨欲凭谁说。无事伤心犹不彻，春时容易别。
木兰花令（唐·魏承班）	小芙蓉，香旖旎，碧玉堂深清似水。闭宝匣，掩金铺，倚屏拖袖愁如醉。迟迟好景烟花媚，曲渚鸳鸯眠锦翅。凝然愁望静相思，一双笑靥嚬香蕊。
玉楼春（唐·魏承班）	寂寂画堂梁上燕，高卷翠帘横数扇。一庭春色恼人来，满地落花红几片。愁倚锦屏低雪面，泪滴绣罗金缕线。好天凉月尽伤心，为是玉郎长不见。
黄钟乐（唐·魏承班）	池塘烟暖草萋萋，惆怅闲宵含恨。愁坐思堪迷，遥想玉人情事远，音容浑似隔桃溪。偏记同欢秋月低，帘外论心花畔。和醉暗相携，何事春来君不见，梦魂长在锦江西。
