噶布陔和许滇生（清·乔重禧）　　五言律诗　押先韵	出卡快扬鞭，朝阳艳锦鞯。碑荒娄室墓，草长塔儿泉。杨柳严边戍，松花问战船。山凹见丛菊，乡梦落吴天。
风云岭（清·乔重禧）　　七言律诗　押庚韵	惊沙风卷夕阳明，松漠茫茫积翠横。残雪数峰犹噤马，落花四月未闻莺。玉盆湾远无牙帐，银铠星寒吊柳城。塞女琵琶边戍角，听来总是可怜声。
阿济克鸠（清·乔重禧）　　七言律诗　押阳韵	玲珑山势俯崇冈，浩浩平沙接大荒。天辟围场资羽猎，地临绝塞走名王。养茸麋鹿呼群衍，得气骅骝恋草香。六合一家还肄武，雄文应陋汉《长杨》。
杏花和祁春浦（清·乔重禧）　　七言律诗　押东韵	十三万众化沙虫，圣武犹传挞伐功。百战艰难成创业，三山形胜矗长空。盘雕影落关云黑，塞马秋腾海日红。开国神谟天助顺，莫将成败论英雄。
大台和诗舲（清·乔重禧）　　七言律诗　押灰韵	兴京王业自天开，捺钵频添驻䟆台。万马横驱厨岭下，六龙晓渡大河来。国陵地迥风云壮，辽塞秋深雨雪催。才子櫜鞬勤载笔，饶歌应陋上之回。
精忠柏歌（清·乔重禧）	风波亭上白日黑，三字狱成碧血碧。千秋冤愤谁见之，惟有凌霜一株柏。柏之生也精气横，柏之死也英风鸣。公生亦生死亦死，如公者死将焉生。柏既不能将身作弓弩，随公直捣黄龙府。又不能化为宝剑如吴钩，出匣径斩奸臣头。且不能效隗顺一狱卒，手捧公尸瘗岩樾。惟此盘屈尘沙中，日对南冠泣秋月。岁岁磨鍊风霜姿，青铜为皮铁为骨。黄天荡里杀气摧，朱仙镇上悲声哀。施全已死背嵬殉，眼见宋室成蒿莱。露叶风枝气郁勃，劲节棱棱谁与夺。纵有日暄雨润时，天地精华不能活。公也与柏原殊形，柏也与公为一身。柏死取其义，公死全其仁。丹心孤干不共劫火没，要使天下万世知其真。尽忠四字公镌背，精忠二字柏堪配。今日见柏如见公，泣下多于赭衣辈。吁嗟乎！古今正气乾坤中，圣贤与物无不同。君不见西湖墓上落日暗，南枝肃肃生寒风。
出山海关和张诗舲（清·乔重禧）　　押灰韵	跸路仙筹驿骑催，扶桑迎面晓霞开。雄关锁钥千山包，沧海朝宗万国来。当日从龙多硕辅，即今射虎亟边才。长城诗思增怀古，策马相期上大台。
