题宋怀豫饮光台（清·孙奇逢）　　五言律诗　押先韵	台敞元无暑，翛然万虑捐。月沾衣带冷，花促酒杯乾。意气悲歌里，风云指顾前。夜深迷去径，独为主人贤。
送友归白下（清·孙奇逢）　　五言律诗　押尤韵	惊看鸿雁北，归带白门秋。恋弟耽孤托，思亲畏远游。装轻惜道路，老至爱朋俦。来岁黄花发，东篱一径留。
长至（清·孙奇逢）　　七言律诗　押侵韵	日临长至雪霜深，倚榻围炉酒自斟。一代是非谁共语，百年感慨入孤吟。闲从竹石同幽梦，静向琴书寄远心。此际阳生人不觉，贞元消息好相寻。
偶题（清·孙奇逢）　　五言绝句　押侵韵	程日多清课，操功不厌深。看云消妄相，调鹤息机心。
读许鲁斋集（清·孙奇逢）　　押麌韵	我读公遗书，知公心最苦。乾坤值元运，民彝已无主。公等二三辈，得君为之辅。伦理未全绝，此功非小补。不陈伐宋谋，天日昭肺腑。题墓有遗言，公意有所取。众以此诮公，未免儒而腐。道行与道尊，两义各千古。
书感（清·孙奇逢）　　押真韵	我来千余里，思见英雄人。胸中罗今古，万物待其新。人也而天游，钓渭与耕莘。不然隐君子，山水乐相邻。丘壑适吾意，皎洁不染尘。二者俱悠邈，斯道竟沈沦。乃知古人出，尧舜其君民。退处林泉下，坐使风俗淳。仁可覆天下，亦可善此一身。此字不分明，痛痒总不亲。庸众是非泯，英雄好恶真。此是经纶手，千古无等伦。
刘佐五设榻兼赠宝刀（清·孙奇逢）	东风吹雪满阑干，晓日清空白画寒。四十年来燕市里，楼前流水红尘起。竿头青苎酒旗摇，有人匣中鸣宝刀。把手赠之锦作带，浑惭下榻逢交泰。坐间肝胆饶素肠，情兴淋漓月照床。烧烛顿忘别话久，香添再煮瓶中酒。春花未吐春衫纡，山色溪光尽入庐。今夜停杯好相语，平明上马过东去。应知依依不胜情，桥南细问黄莺声。中天斗畔高明月，莫教清笳吹石碣。云绕蓟门老纶巾，路傍羞对看花人。
