送亚匏之粤东（清·孙文川）　　七言律诗　押庚韵	仅从虎口剩余生，又被饥驱万里行。故国河山方百战，残年风雪竟孤征。轻肥岂是无同学，鸡黍何时践耦耕。强欲留君留不得，一帆天际若为情。
张烈士行（清·孙文川）	不破一甲折一矢，数十贼魁同日死。贼自杀贼谁所使，死不忘君一烈士。烈士少孤气峥嵘，弱冠胶庠已有声。往年长沙贼攻急，曾参筹笔撄危城。功成身退名不居，先人金陵有敝庐。冒雪冲风返故里，转身贼来如捣虚。城陷人思脱虎口，烈士摇头独否否。公等行矣了一身，我愚欲展回天手。诡作书吏冀贼容，密封细字达军中。元戎读罢手加额，谓此上策吾当从。长发毵毵小袖衣，出城入城贼不知。军门立谈定大计，约期内应迎王师。大事垂成谋竟泄，可怜壮士空相结。毒刑备受命如丝，且竭吾忠用吾舌。纵不能斫妖鸟头，盍剪羽翼无使留。纵不能制猛虎命，盍断爪牙无使横。瞋目大呼认不讳，同谋尚有老兄弟。指引某某皆其尤，贼怒切齿惊夺气。果然同类自相戕，烈士亦死神扬扬。传闻慷慨捐躯处，云惨风凄小教场。吁嗟乎！金陵节烈俱捐生，烈士铁中之铮铮。一息仅存尚报国，临危不乱尤难能。他日褒忠恤典大书烈士名，江宁府学廪生张继庚。
铁骡歌（清·孙文川）	骊龙昼见钟山坳，似乘雷雨来东郊。浑身黝漆不见毫，昂头修尾四足高。有客告予此铁骡，元戎乘之功最多。去年九江被贼逼，此骡一跃飞渡河。而今元戎不出战，骡亦精神渐凋丧。譬如英雄不见用，往往临风动惆怅。我劝铁骡心勿悲，汝诚倜傥空所向。元戎官贵统全师，不在将兵在将将。一朝下令麾虎貔，金陵攻克无逾期。捷书飞骑驰京师，舍汝不用吁其谁，汝且伏枥需良时。
读谢介鹤明府汉西生稿三十二韵（清·孙文川）	定交已八载，道义互劘切。金陵昔从军，图贼力共竭。奉檄谋内应，奇士广连结。君时闯鬼门，我亦蹈黥穴。微服走间道，窟室莅歃血。欲夺万夫关，先凭三寸舌。果然忠义士，闻言眦自裂。齐愤越甲鸣，各抱鲁连节。定期迎王师，誓将枭獍灭。吾党有田生，临时有勇决。夜黑潜登城，杀贼持劲铁。其奈事不成，自此谋亦泄。同志百余人，就义膝不屈。铮铮张茂才，濒死计用谲。诬贼为同谋，所指皆雄杰。坐使骈首戮，爪牙自剪截。当贼闭门索，四面罗网列。田生挈数客，神龙去飘瞥。未几君亦逸，虎口不遭齧。出险每惊喜，感旧增呜咽。长揖辞军门，与我遂相别。何期申江游，聚首复欢悦。君已登仕版，济时异我拙。今年督舟师，防秋励士卒。寇退叙劳勚，擢职拜丹阙。示我旧诗篇，往事如重阅。回忆石城门，君逃甚孤孑。感此命名意，令我森毛发。诗中危险境，一一我能说。《小雅》多哀音，忠爱心如揭。却念贼势张，时事更杌隉。沧海悲横流，掩掩卷倍愁绝。
嗟哉华尔行（清·孙文川）	亚墨利加洲，有爱育士迭国，去中华三万余里。其国之人皆泰西诸邦所迁徒。背英吉利苛政自立，日富以强。有华盛顿创为传贤之法法最良。行之数传，民和世康。其国左右皆大洋，旁峙落机大山万里长。我皇咸丰十年，其国之人华尔慕化而至。值乱贼被猖，杀人肝脑涂地。华尔曰嘻，我夷兵官也，今见官军乃儿戏。彼乱贼人人得诛之。吾虽外臣，愿为朝廷敌忾。嗟哉华尔！愤不顾身，大吏言于朝，授以兵五百人。华尔教以泰西阵法，坐作进退无逡巡。飞炮中敌无一生，遂克松江守其城。克宁波，留其军，又克周浦金山，无不以一当百，海上处处闻威声。皇帝嘉之，拜官副总兵。华尔感激，愿属籍受廛，世为中国民。彼金日磾契苾何力往矣，今有华尔，乃能继汉唐蕃将成功名。嗟哉华尔！今年八月，宁波告急，华尔方守松江，以兵授其佐，自往奋击。时贼众数万在慈溪邑，华尔率健儿冲锋镝。不知贼中乃有奸夷助死力，一枪击中华尔额，遂以是日死于敌。嗟哉华尔，谁将与俦。时之人，将军不武，士卒不同仇。食君之禄，遭时之难，而沓沓无忧。彼外国人食毛践土岁余耳，乃能为国授命，我国将士闻之胡不羞。嗟哉华尔，谁堪与俦。
赵忠毅铁如意歌（清·孙文川）	黑云一朵白虹气，凛凛寒风鬼愁避。铭文廿六署姓字，乃是高邑赵公铁如意。公之烈性百炼刚，指挥亦见铁石肠。公之定力千钧强，谈笑亦飞铁面霜。我观公物识公志，弗若是折秉道义。珊瑚碎，亦无赖，何似公掌选司，志在屏四害。唾壶缺，安足雄，何似公坐都堂，志在除四凶。将使汝为朱云上方剑，斩佞臣头进直谏。将使汝为司农袖中笏，击逆竖首舒愤郁。奈何钩党纷纭君听谗，元凶争指群耽耽。不如意事真八九，为同心人仅二三。锻炼深文竟被逐，西厂权弄东林覆。太阿倒持事日非，逆案迟成公已没。如意兮如意，我不知击阉之疏草罢时，可曾携汝起舞扬双眉。又不知雁门关外荷戈日，可曾持汝悲歌望京邑。问汝汝无言，但见土花惨澹面冷无颜色，似有无限烦冤诉不得。呜呼茄花委鬼魁柄干，聚六州铁铸错难。饮刃终成白马驿，赐环遑望金鸡竿。朝局既坏社亦屋，历劫乌金犹在握。当时公盼东方明，祇今人效西台哭。君不见见泉儿奉圣母，附九千岁同掣肘。神鼎如在难铸形，话柄虽传耻污口。惟公奇觚矢赤衷，无愧铮铮在铁中。遗物犹为人爱惜，不惟瑰宝惟孤忠。昔年得公书，什袭珍手泽。今又得如意，峥嵘森毅魄。我欲快磨铁砚，椎拓墨本作画图。更将豪挥铁笔，大书铭词张座侧。见者惊心读挢舌，何物犹矜炙手热，请看区区一片铁。
