山居即事（清·施远恩）　　五言律诗　押删韵	秋声动岩壑，爽气满柴关。红叶高低树，白云远近山。肩因长病耸，发为苦吟斑。宠辱浑閒事，浮名似可删。
秋兴（清·施远恩）　　七言律诗　押东韵	愁破方知酒有功，酒杯尽日不教空。飘萧败叶千山雨，零乱寒花一径风。小摘晚菘含露碧，试尝新橘带霜红。閒中自有消閒趣，底事矶边理钓筒。
龙虎山早秋（清·施远恩）　　七言律诗　押尤韵	上清苑木记深幽，老桂婆娑报早秋。露冷草虫鸣四壁，月明桐叶坠层楼。雷坛树色当窗出，丹井泉香绕石流。林壑寂寥龙虎伏，岩前惟见紫云浮。
大光明殿步虚词（清·施远恩）　　七言绝句　押先韵	巍巍金阙耸瑶天，羽盖朱轮满大千。惭愧野人樗散甚，侍香亲到至尊前。
老桂行（清·施远恩）	阶前双桂高百尺，势凌霄汉根盘石。露染鹅黄一片秋，枝头簇簇团香雪。不随桃李斗春工，玉缀玲珑荫瑶席。花时供我日日吟，剥啄寻香有来客。一从访道西江游，梦绕吴山怅暌隔。忽忽烟霞十六更，树影健在人非昔。去秋赋归来，喜见旧标格。花繁料料金，叶展重重碧。一樽浓醁酹花神，与尔周旋仍日夕。桂兮桂兮誓将相守不相离，老向山中甘遁迹。
老朴行（清·施远恩）	环山百年树，其名曰沙朴。婆娑烟雨姿，分荫到邻屋。具兹千霄材，应入工师目。托根不得地，远弃在南服。绳尺恐难施，拥肿更蜷曲。鸱鸮巢其巅，蝼蚁穴其腹。生意良已尽，雨露非不渥。未充梁栋选，颇避斧斤斸。安知终天年，非以不材福。至哉庄生言，宁甘老荒谷。
大光明殿步虚词 其三（清·施远恩）　　押文韵	五铢衣覆九霞裙，上界颁来十赍文。何处飞翔双白鹤，夜深还拜玉晨君。
