西湖夕泛（清·朱清远）　　七言律诗　押青韵	跳珠滴露雨初停，为爱宵凉泛小舲。青柳袅风丝细细，白莲扶月玉亭亭。依微烟抹山坳树，散碎镫摇水面萤。诗就长吟殊自得，游鱼几队出波听。
春昼曲（清·朱清远）	帘钩微上帘旌飘，明窗净几殊清寥。眉子砚开墨新试，耳彝炉烬香先烧。兰阶细细和风动，一桁幽香鬓边送。朱喙轻圆语慧鹦，粉腰婀娜飞幺凤。幽居空谷日迟迟，倚竹拈花足解颐。乍可湖云丝柳抹，频经山雨锦苔滋。宜书宜画还宜绣，取次安排消永昼。笋香茶味足清娱，镜中诗里从消瘦。
游韬光寺（清·朱清远）　　押漾韵	万山环拜人，人出万竹上。湖绿江光白，海气黑漭荡。回顾所来径，苍翠列步障。绝胜理安寺，松巅游目放。何况住小楼，奚数浮画舫。流览尚未足，逸兴盘空王。仙台上一层，寰瀛彻万状。
秋湖泛月歌（清·朱清远）	疏星落落银河空，纤云碧宇盘秋容。湖光月光一气化，双舻呕轧摇烟中。莹然一镜玻璃豁，千山倒涌千芙蓉。中流照影影溶漾，心胆魂魄都玲珑。两鬓幽兰花怒放，露华微浸芳磬浓。萤点晦明水纹逗，柳阴淡荡风力慵。晚荷夜香转清绝，天香傥共飘璇穹。微尘大千界远隔，清气卅六天应通。珊珊顿欲翥仙骨，广寒即此疑仙宫。独惜冷泉亭咫尺，隔山未得洄溯从。不然乘兴遂幽讨，梯云直上飞来峰。秋心上诉嫦娥下，携我入月凌罡风。却从月中看湖月，定如玉泉一掬青濛濛。
渡江中流作歌（清·朱清远）	吾乡钱唐江水绿，深或及寻浅一掬。扁舟曾作严陵游，照影中流波绉玉。大江今日放楼船，洪涛无岸包长天。风帆瞬息百馀里，飞行绝迹如飞仙。咫尺妖氛缠北固，铁骑水犀都却顾。愤深郎主枌榆乡，亲看发竖冲冠怒。南宋当年战两雄，此江有女在军中。输他桴鼓能亲执，坐想英姿起敬恭。
彼美篇（清·朱清远）	酒食是议妇人事，车挽庑春并高致。此犹贫贱扬芳徽，椎髻案眉随所遇。夫为司徒妻赴薪，彼美风节何清真。道蕴咏絮馀事耳，寻常摘句何足云。
舟中望衡岳（清·朱清远）　　押霰韵	万朵金芙蓉，璀璨破空见。瑰奇魏夫人，阴阳态千变。欻登天柱峰，三湘俯匹练。篷窗隐几卧，飞行疾于电。忽闻欸乃声，梦觉目犹眩。一瓯君山茶，从容望九面。
川江志险（清·朱清远）	侬家西湖若仙沚，拿舟打桨图画里。平流容与随閒鸥，蹁跹裙屐仙游拟。长江洞庭从宦游，虽涉浩荡同安流。鱼龙不惊桧楫驶，天日朗照蒲帆遒。黔阳千里云山度，绝险奇危经几处。足蹑俊鹘还行吟，舆触飞猱了无怖。川江此日浮大航，仲冬江水消汪洋。不风不浪舟震动，相持相顾人惊惶。仿偟良久榜人说，此是名滩最奇崛。荡析倾履无时无，吾徒到此心胆愲。少焉遄行舟渐安，推窗十二横峰峦。且看奇峭云鬟斗，莫怅归来蜀道难。
