春日田园杂兴（清·陆世仪）　　七言律诗　押阳韵	墙角春风吹棣棠，菜花香里豆花香。看鱼独立小池影，数笋闲行竹筱长。白眼望天非是醉，科头混俗若为狂。莫嫌世外人疏放，彭泽情深胜沅湘。
喜宋子犹从上海归赋赠（清·陆世仪）　　七言律诗　押庚韵	十年蹈海一身轻，故国重回代已更。梦里鲸波如昨日，尊前鲑菜只平生。乾坤何处容孤往，丘壑吾侪且耦耕。遁世工夫正无限，可能相助一经营。
遥哭希声钱公（清·陆世仪）　　七言律诗　押歌韵	中原倾覆事如何，穷海孤臣强负戈。利钝由天非所计，鞠躬自我更无他。流离尚欲书章句，疾革犹闻唤渡河。正气如公那可灭，涛声隐隐似悲歌。
重阳后一日含绿堂吟社雅集分韵得七虞（清·陆世仪）　　七言律诗　押虞韵	茱萸插罢酒还沽，余兴龙山尚未孤。万古乾坤皆草莽，一时人物在菰芦。月泉开社天星聚，铁匣缄诗井水枯。宇内谁成三不朽，壮心空老北山愚。
次韵挽瞿稼轩归葬（清·陆世仪）　　七言律诗　押尤韵	砥柱乾坤赖老谋，那堪宰相尽风流。横江已断千寻锁，筹国谁开万里楼？南粤兵戈行殿恨，东皋花木故园愁。渡河只有宗留守，恸哭相从地下游。
感遇诗（清·陆世仪）	潜鱼怀深渊，飞鸟慕青冥。志尚各有适，罗弋纷四陈。神龙失云雾，蠖伏同众鳞。哲士无势位，俯首齐凡民。仰叹发浩歌，悲来痛填膺。气数苟在天，匹夫岂能争。时予避地水村，土人乱，复入城。仲雍避荆吴，断发文其身。殷箕遘昏乱，佯狂受奴髡。少连柳下惠，降辱称逸民。微服过宋都，去衣入裸人。在昔大圣哲，处困皆有伦。区区卑贱子，含垢安足嗔。伏读明夷卦，悠然感我心。柔顺以蒙难，艰贞晦其明。踬马恒破车，恶妇恒破家。冠帻事攻劫，安能正奇邪。汉家四百载，党祸为萌芽。处士盛名节，朝廷非所嘉。名节尚不可，何况群骄奢。
送闽中林衡者游中原长歌（清·陆世仪）	石斋先生天下师，君能弱冠长揖之。著书如风腕欲脱，吐论凿凿称雄奇。石斋为君亦拱手，略尽形骸呼小友。赠君药言送君诗，直欲与君分半亩①。天公天公何不仁，忠臣饿死英雄贫。岭云如山战骨白，至今闽海飞征尘。男儿致身苦不早，双鬓蹉跎浑欲老。安能局促辕下驹，凤凰翱翔在苍昊。束书蹑屩作壮游，志气直欲凌九州。扁舟千里入吴会，上书论古惊同俦。腐儒如予那足道，感君意气为倾倒。挥毫赠我琅玕辞，愧乏琼瑶无以报。君今策蹇问中原，山川漫漫道路昏。胡琴欲碎向何处，夜半起舞心烦冤。金陵城中王气尽，蒋山断树生芝菌。日落江潮惨不波，维扬明月歌春蚓。君不见昔日江东祖士雅，击楫中流泪盈把。又不见辽东皂帽翁，语维经典甘孤穷。丈夫处世只两途，吾子坎壈将安终。中原人才颇不恶，风尘往往倾然诺。昂藏七尺未长贫，暗中定可相摸索。归来好复过桴亭，西窗剪烛开短屏。交知四海见吾子，相对使人双眼青。
春日田园杂兴 其三（清·陆世仪）	一夜东风春雨赊，起看流水入沟斜。篱头未下丝瓜种，墙脚先开蚕豆花。稚子凿池浮乳鸭，老翁摊箔晒新暇。已知身世无余乐，聊尔徜徉未是差。
甑山士（清·陆世仪）	甑山士，甑山士，甑底山头授书史。人生何用读五车，但须一识忠孝旨。轺东北来饮江水，金凫银雁飞都市。越国风尘高蔽天，两缸覆我甑山前。上有碧落下黄泉，冥冥长夜年复年。普天绝无乾净地，甑山犹存土一篑。
